### ISSUE TITLE
ns-O-RAN unable to connect to the E2 Term of the RIC

### ISSUE THREAD

**Issue by sonalichaudhari37** [wineslab/ns-o-ran-ns3-mmwave#12]
Hi, 

I'm following tutorial available on link: https://openrangym.com/tutorials/ns-o-ran
I started E2Term on first terminal, sample-xapp on second terminal and scenario-zero.cc on third terminal. But I am not getting expected output (message exchanges). I'm adding logs I got in these terminals. Please let me know how this problem can be resolved.

**e2term:**

{"ts":1716387878887,"crit":"DEBUG","id":"E2Terminator","mdc":{"thread id":"139896705799936"},"msg":"Message from Xapp RAN name = gnb:131-133-31000000 message length = 40"}
{"ts":1716387878887,"crit":"INFO","id":"E2Terminator","mdc":{"thread id":"139896705799936"},"msg":"send message to gnb:131-133-31000000 address"}
{"ts":1716387878887,"crit":"ERROR","id":"E2Terminator","mdc":{"thread id":"139896705799936"},"msg":"Failed to send message no CU entry gnb:131-133-31000000"}
{"ts":1716387888888,"crit":"DEBUG","id":"E2Terminator","mdc":{"thread id":"139896705799936"},"msg":"Message from Xapp RAN name = gnb:131-133-32000000 message length = 40"}
{"ts":1716387888888,"crit":"INFO","id":"E2Terminator","mdc":{"thread id":"139896705799936"},"msg":"send message to gnb:131-133-32000000 address"}
{"ts":1716387888888,"crit":"ERROR","id":"E2Terminator","mdc":{"thread id":"139896705799936"},"msg":"Failed to send message no CU entry gnb:131-133-32000000"}
{"ts":1716387898888,"crit":"DEBUG","id":"E2Terminator","mdc":{"thread id":"139896705799936"},"msg":"Message from Xapp RAN name = gnb:131-133-33000000 message length = 40"}
{"ts":1716387898888,"crit":"INFO","id":"E2Terminator","mdc":{"thread id":"139896705799936"},"msg":"send message to gnb:131-133-33000000 address"}
{"ts":1716387898888,"crit":"ERROR","id":"E2Terminator","mdc":{"thread id":"139896705799936"},"msg":"Failed to send message no CU entry gnb:131-133-33000000"}
{"ts":1716387908889,"crit":"DEBUG","id":"E2Terminator","mdc":{"thread id":"139896705799936"},"msg":"Message from Xapp RAN name = gnb:131-133-34000000 message length = 40"}
{"ts":1716387908889,"crit":"INFO","id":"E2Terminator","mdc":{"thread id":"139896705799936"},"msg":"send message to gnb:131-133-34000000 address"}
{"ts":1716387908889,"crit":"ERROR","id":"E2Terminator","mdc":{"thread id":"139896705799936"},"msg":"Failed to send message no CU entry gnb:131-133-34000000"}
{"ts":1716387918889,"crit":"DEBUG","id":"E2Terminator","mdc":{"thread id":"139896705799936"},"msg":"Message from Xapp RAN name = gnb:131-133-35000000 message length = 40"}
{"ts":1716387918889,"crit":"INFO","id":"E2Terminator","mdc":{"thread id":"139896705799936"},"msg":"send message to gnb:131-133-35000000 address"}
{"ts":1716387918889,"crit":"ERROR","id":"E2Terminator","mdc":{"thread id":"139896705799936"},"msg":"Failed to send message no CU entry gnb:131-133-35000000"}

**sample-xapp:**

Waiting for xApp connection on port 4200
Xapp Name is: hwxapp
{"ts":1716387875885,"crit":"INFO","id":"hw_xapp_main","mdc":{},"msg":"Starting thread 140492683523904"}
{"ts":1716387875885,"crit":"INFO","id":"hw_xapp_main","mdc":{},"msg":"Xapp Name set to hwxapp from environment variable"}
{"ts":1716387875885,"crit":"INFO","id":"hw_xapp_main","mdc":{},"msg":"Xapp ID set to hwxapp from environment variable"}
{"ts":1716387875886,"crit":"INFO","id":"hw_xapp_main","mdc":{},"msg":"Ports set to 4560 from environment variable"}
1716387875 44/RMR [INFO] ric message routing library on SI95/g mv=3 flg=00 (f1d10cd 4.0.5 built: May  7 2020)
{"ts":1716387875886,"crit":"INFO","id":"hw_xapp_main","mdc":{},"msg":">>> waiting for RMR, file= xapp-utils/xapp_rmr.cc, line=59"}
{"ts":1716387876886,"crit":"INFO","id":"hw_xapp_main","mdc":{},"msg":"RMR Context is Ready, file= xapp-utils/xapp_rmr.cc, line=63"}
{"ts":1716387876886,"crit":"INFO","id":"hw_xapp_main","mdc":{},"msg":"Created Hello World Xapp Instance"}
1716387876 44/RMR [INFO] sends: ts=1716387876 src=e388fb7afafc:4560 target=service-ricplt-a1mediator-rmr.ricplt:4562 open=0 succ=0 fail=0 (hard=0 soft=0)
1716387876 44/RMR [INFO] sends: ts=1716387876 src=e388fb7afafc:4560 target=10.0.2.10:38000 open=0 succ=0 fail=0 (hard=0 soft=0)
{"ts":1716387877886,"crit":"INFO","id":"hw_xapp_main","mdc":{},"msg":"Starting Listener Threads. Number of Workers = 1"}
{"ts":1716387877886,"crit":"INFO","id":"hw_xapp_main","mdc":{},"msg":"Receiver Thread file= xapp.cc, line=172"}
{"ts":1716387877886,"crit":"INFO","id":"hw_xapp_main","mdc":{},"msg":"Starting receiver thread 140492406781696"}
{"ts":1716387877886,"crit":"INFO","id":"hw_xapp_main","mdc":{},"msg":"Listening at Thread: 140492406781696"}
gNB read: gnb:131-133-31000000
gNB read: gnb:131-133-32000000
gNB read: gnb:131-133-33000000
gNB read: gnb:131-133-34000000
gNB read: gnb:131-133-35000000
Opening control socket with host 127.0.0.1:4200
Opened control socket server on port 7000
{"ts":1716387878887,"crit":"INFO","id":"hw_xapp_main","mdc":{},"msg":"Preparing to send subscription in file= xapp.cc, line=427"}
Sending subscriptions to: gnb:131-133-31000000
Opening RX thread with agent 127.0.0.1
{"ts":1716387878887,"crit":"INFO","id":"hw_xapp_main","mdc":{},"msg":"Sending subscription in file= xapp.cc, line=478 for MEID gnb:131-133-31000000"}
add_request_entry gnb:131-133-31000000
Added status pending to request gnb:131-133-31000000
{"ts":1716387878887,"crit":"INFO","id":"hw_xapp_main","mdc":{},"msg":"Sending thread 140492683523904"}
xApp connected: 127.0.0.1:45776
{"ts":1716387878887,"crit":"INFO","id":"hw_xapp_main","mdc":{},"msg":"Message Sent: RMR State = RMR_OK"}
{"ts":1716387878887,"crit":"INFO","id":"hw_xapp_main","mdc":{},"msg":"./xapp-mgmt/subs_mgmt.hpp, 192 :: Transmitted subscription request for trans_id gnb:131-133-31000000"}
get_request_status gnb:131-133-31000000
{"ts":1716387888887,"crit":"ERROR","id":"hw_xapp_main","mdc":{},"msg":"./xapp-mgmt/subs_mgmt.hpp, 223:: Subscription request with transaction id gnb:131-133-31000000 timed out waiting for response "}
{"ts":1716387888887,"crit":"INFO","id":"hw_xapp_main","mdc":{},"msg":"Entry for Transaction ID deleted: gnb:131-133-31000000"}
{"ts":1716387888887,"crit":"INFO","id":"hw_xapp_main","mdc":{},"msg":"Subscription SUCCESSFUL in file= xapp.cc, line=483 for MEID gnb:131-133-31000000"}
{"ts":1716387888887,"crit":"DEBUG","id":"hw_xapp_main","mdc":{},"msg":"Freeing subscription request memory"}
{"ts":1716387888887,"crit":"DEBUG","id":"hw_xapp_main","mdc":{},"msg":"Freed subscription request memory "}
{"ts":1716387888887,"crit":"DEBUG","id":"hw_xapp_main","mdc":{},"msg":"Freeing subscription request memory"}
{"ts":1716387888887,"crit":"DEBUG","id":"hw_xapp_main","mdc":{},"msg":"Freed subscription request memory "}
Sending subscriptions to: gnb:131-133-32000000
{"ts":1716387888887,"crit":"INFO","id":"hw_xapp_main","mdc":{},"msg":"Sending subscription in file= xapp.cc, line=478 for MEID gnb:131-133-32000000"}
add_request_entry gnb:131-133-32000000
Added status pending to request gnb:131-133-32000000
{"ts":1716387888887,"crit":"INFO","id":"hw_xapp_main","mdc":{},"msg":"Sending thread 140492683523904"}
{"ts":1716387888887,"crit":"INFO","id":"hw_xapp_main","mdc":{},"msg":"Message Sent: RMR State = RMR_OK"}
{"ts":1716387888887,"crit":"INFO","id":"hw_xapp_main","mdc":{},"msg":"./xapp-mgmt/subs_mgmt.hpp, 192 :: Transmitted subscription request for trans_id gnb:131-133-32000000"}
get_request_status gnb:131-133-32000000
{"ts":1716387898888,"crit":"ERROR","id":"hw_xapp_main","mdc":{},"msg":"./xapp-mgmt/subs_mgmt.hpp, 223:: Subscription request with transaction id gnb:131-133-32000000 timed out waiting for response "}
{"ts":1716387898888,"crit":"INFO","id":"hw_xapp_main","mdc":{},"msg":"Entry for Transaction ID deleted: gnb:131-133-32000000"}
{"ts":1716387898888,"crit":"INFO","id":"hw_xapp_main","mdc":{},"msg":"Subscription SUCCESSFUL in file= xapp.cc, line=483 for MEID gnb:131-133-32000000"}
{"ts":1716387898888,"crit":"DEBUG","id":"hw_xapp_main","mdc":{},"msg":"Freeing subscription request memory"}
{"ts":1716387898888,"crit":"DEBUG","id":"hw_xapp_main","mdc":{},"msg":"Freed subscription request memory "}
{"ts":1716387898888,"crit":"DEBUG","id":"hw_xapp_main","mdc":{},"msg":"Freeing subscription request memory"}
{"ts":1716387898888,"crit":"DEBUG","id":"hw_xapp_main","mdc":{},"msg":"Freed subscription request memory "}
Sending subscriptions to: gnb:131-133-33000000
{"ts":1716387898888,"crit":"INFO","id":"hw_xapp_main","mdc":{},"msg":"Sending subscription in file= xapp.cc, line=478 for MEID gnb:131-133-33000000"}
add_request_entry gnb:131-133-33000000
Added status pending to request gnb:131-133-33000000
{"ts":1716387898888,"crit":"INFO","id":"hw_xapp_main","mdc":{},"msg":"Sending thread 140492683523904"}
{"ts":1716387898888,"crit":"INFO","id":"hw_xapp_main","mdc":{},"msg":"Message Sent: RMR State = RMR_OK"}
{"ts":1716387898888,"crit":"INFO","id":"hw_xapp_main","mdc":{},"msg":"./xapp-mgmt/subs_mgmt.hpp, 192 :: Transmitted subscription request for trans_id gnb:131-133-33000000"}
1716387907 44/RMR [INFO] sends: ts=1716387907 src=e388fb7afafc:4560 target=service-ricplt-a1mediator-rmr.ricplt:4562 open=0 succ=0 fail=0 (hard=0 soft=0)
1716387907 44/RMR [INFO] sends: ts=1716387907 src=e388fb7afafc:4560 target=10.0.2.10:38000 open=1 succ=3 fail=0 (hard=0 soft=0)
get_request_status gnb:131-133-33000000
{"ts":1716387908888,"crit":"ERROR","id":"hw_xapp_main","mdc":{},"msg":"./xapp-mgmt/subs_mgmt.hpp, 223:: Subscription request with transaction id gnb:131-133-33000000 timed out waiting for response "}
{"ts":1716387908888,"crit":"INFO","id":"hw_xapp_main","mdc":{},"msg":"Entry for Transaction ID deleted: gnb:131-133-33000000"}
{"ts":1716387908888,"crit":"INFO","id":"hw_xapp_main","mdc":{},"msg":"Subscription SUCCESSFUL in file= xapp.cc, line=483 for MEID gnb:131-133-33000000"}
{"ts":1716387908888,"crit":"DEBUG","id":"hw_xapp_main","mdc":{},"msg":"Freeing subscription request memory"}
{"ts":1716387908888,"crit":"DEBUG","id":"hw_xapp_main","mdc":{},"msg":"Freed subscription request memory "}
{"ts":1716387908888,"crit":"DEBUG","id":"hw_xapp_main","mdc":{},"msg":"Freeing subscription request memory"}
{"ts":1716387908888,"crit":"DEBUG","id":"hw_xapp_main","mdc":{},"msg":"Freed subscription request memory "}
Sending subscriptions to: gnb:131-133-34000000
{"ts":1716387908888,"crit":"INFO","id":"hw_xapp_main","mdc":{},"msg":"Sending subscription in file= xapp.cc, line=478 for MEID gnb:131-133-34000000"}
add_request_entry gnb:131-133-34000000
Added status pending to request gnb:131-133-34000000
{"ts":1716387908888,"crit":"INFO","id":"hw_xapp_main","mdc":{},"msg":"Sending thread 140492683523904"}
{"ts":1716387908888,"crit":"INFO","id":"hw_xapp_main","mdc":{},"msg":"Message Sent: RMR State = RMR_OK"}
{"ts":1716387908889,"crit":"INFO","id":"hw_xapp_main","mdc":{},"msg":"./xapp-mgmt/subs_mgmt.hpp, 192 :: Transmitted subscription request for trans_id gnb:131-133-34000000"}
get_request_status gnb:131-133-34000000
{"ts":1716387918889,"crit":"ERROR","id":"hw_xapp_main","mdc":{},"msg":"./xapp-mgmt/subs_mgmt.hpp, 223:: Subscription request with transaction id gnb:131-133-34000000 timed out waiting for response "}
{"ts":1716387918889,"crit":"INFO","id":"hw_xapp_main","mdc":{},"msg":"Entry for Transaction ID deleted: gnb:131-133-34000000"}
{"ts":1716387918889,"crit":"INFO","id":"hw_xapp_main","mdc":{},"msg":"Subscription SUCCESSFUL in file= xapp.cc, line=483 for MEID gnb:131-133-34000000"}
{"ts":1716387918889,"crit":"DEBUG","id":"hw_xapp_main","mdc":{},"msg":"Freeing subscription request memory"}
{"ts":1716387918889,"crit":"DEBUG","id":"hw_xapp_main","mdc":{},"msg":"Freed subscription request memory "}
{"ts":1716387918889,"crit":"DEBUG","id":"hw_xapp_main","mdc":{},"msg":"Freeing subscription request memory"}
{"ts":1716387918889,"crit":"DEBUG","id":"hw_xapp_main","mdc":{},"msg":"Freed subscription request memory "}
Sending subscriptions to: gnb:131-133-35000000
{"ts":1716387918889,"crit":"INFO","id":"hw_xapp_main","mdc":{},"msg":"Sending subscription in file= xapp.cc, line=478 for MEID gnb:131-133-35000000"}
add_request_entry gnb:131-133-35000000
Added status pending to request gnb:131-133-35000000
{"ts":1716387918889,"crit":"INFO","id":"hw_xapp_main","mdc":{},"msg":"Sending thread 140492683523904"}
{"ts":1716387918889,"crit":"INFO","id":"hw_xapp_main","mdc":{},"msg":"Message Sent: RMR State = RMR_OK"}
{"ts":1716387918889,"crit":"INFO","id":"hw_xapp_main","mdc":{},"msg":"./xapp-mgmt/subs_mgmt.hpp, 192 :: Transmitted subscription request for trans_id gnb:131-133-35000000"}
get_request_status gnb:131-133-35000000
{"ts":1716387928889,"crit":"ERROR","id":"hw_xapp_main","mdc":{},"msg":"./xapp-mgmt/subs_mgmt.hpp, 223:: Subscription request with transaction id gnb:131-133-35000000 timed out waiting for response "}
{"ts":1716387928889,"crit":"INFO","id":"hw_xapp_main","mdc":{},"msg":"Entry for Transaction ID deleted: gnb:131-133-35000000"}
{"ts":1716387928889,"crit":"INFO","id":"hw_xapp_main","mdc":{},"msg":"Subscription SUCCESSFUL in file= xapp.cc, line=483 for MEID gnb:131-133-35000000"}
{"ts":1716387928889,"crit":"DEBUG","id":"hw_xapp_main","mdc":{},"msg":"Freeing subscription request memory"}
{"ts":1716387928889,"crit":"DEBUG","id":"hw_xapp_main","mdc":{},"msg":"Freed subscription request memory "}
{"ts":1716387928889,"crit":"DEBUG","id":"hw_xapp_main","mdc":{},"msg":"Freeing subscription request memory"}
{"ts":1716387928889,"crit":"DEBUG","id":"hw_xapp_main","mdc":{},"msg":"Freed subscription request memory "}
1716387938 44/RMR [INFO] sends: ts=1716387938 src=e388fb7afafc:4560 target=service-ricplt-a1mediator-rmr.ricplt:4562 open=0 succ=0 fail=0 (hard=0 soft=0)
1716387938 44/RMR [INFO] sends: ts=1716387938 src=e388fb7afafc:4560 target=10.0.2.10:38000 open=1 succ=5 fail=0 (hard=0 soft=0)
1716387969 44/RMR [INFO] sends: ts=1716387969 src=e388fb7afafc:4560 target=service-ricplt-a1mediator-rmr.ricplt:4562 open=0 succ=0 fail=0 (hard=0 soft=0)
1716387969 44/RMR [INFO] sends: ts=1716387969 src=e388fb7afafc:4560 target=10.0.2.10:38000 open=1 succ=5 fail=0 (hard=0 soft=0)
1716388000 44/RMR [INFO] sends: ts=1716388000 src=e388fb7afafc:4560 target=service-ricplt-a1mediator-rmr.ricplt:4562 open=0 succ=0 fail=0 (hard=0 soft=0)
1716388000 44/RMR [INFO] sends: ts=1716388000 src=e388fb7afafc:4560 target=10.0.2.10:38000 open=1 succ=5 fail=0 (hard=0 soft=0)
1716388031 44/RMR [INFO] sends: ts=1716388031 src=e388fb7afafc:4560 target=service-ricplt-a1mediator-rmr.ricplt:4562 open=0 succ=0 fail=0 (hard=0 soft=0)
1716388031 44/RMR [INFO] sends: ts=1716388031 src=e388fb7afafc:4560 target=10.0.2.10:38000 open=1 succ=5 fail=0 (hard=0 soft=0)
1716388062 44/RMR [INFO] sends: ts=1716388062 src=e388fb7afafc:4560 target=service-ricplt-a1mediator-rmr.ricplt:4562 open=0 succ=0 fail=0 (hard=0 soft=0)
1716388062 44/RMR [INFO] sends: ts=1716388062 src=e388fb7afafc:4560 target=10.0.2.10:38000 open=1 succ=5 fail=0 (hard=0 soft=0)
1716388093 44/RMR [INFO] sends: ts=1716388093 src=e388fb7afafc:4560 target=service-ricplt-a1mediator-rmr.ricplt:4562 open=0 succ=0 fail=0 (hard=0 soft=0)
1716388093 44/RMR [INFO] sends: ts=1716388093 src=e388fb7afafc:4560 target=10.0.2.10:38000 open=1 succ=5 fail=0 (hard=0 soft=0)
1716388124 44/RMR [INFO] sends: ts=1716388124 src=e388fb7afafc:4560 target=service-ricplt-a1mediator-rmr.ricplt:4562 open=0 succ=0 fail=0 (hard=0 soft=0)
1716388124 44/RMR [INFO] sends: ts=1716388124 src=e388fb7afafc:4560 target=10.0.2.10:38000 open=1 succ=5 fail=0 (hard=0 soft=0)
1716388155 44/RMR [INFO] sends: ts=1716388155 src=e388fb7afafc:4560 target=service-ricplt-a1mediator-rmr.ricplt:4562 open=0 succ=0 fail=0 (hard=0 soft=0)
1716388155 44/RMR [INFO] sends: ts=1716388155 src=e388fb7afafc:4560 target=10.0.2.10:38000 open=1 succ=5 fail=0 (hard=0 soft=0)
1716388186 44/RMR [INFO] sends: ts=1716388186 src=e388fb7afafc:4560 target=service-ricplt-a1mediator-rmr.ricplt:4562 open=0 succ=0 fail=0 (hard=0 soft=0)
1716388186 44/RMR [INFO] sends: ts=1716388186 src=e388fb7afafc:4560 target=10.0.2.10:38000 open=1 succ=5 fail=0 (hard=0 soft=0)
1716388487 44/RMR [INFO] sends: ts=1716388487 src=e388fb7afafc:4560 target=service-ricplt-a1mediator-rmr.ricplt:4562 open=0 succ=0 fail=0 (hard=0 soft=0)
1716388487 44/RMR [INFO] sends: ts=1716388487 src=e388fb7afafc:4560 target=10.0.2.10:38000 open=1 succ=5 fail=0 (hard=0 soft=0)
1716388788 44/RMR [INFO] sends: ts=1716388788 src=e388fb7afafc:4560 target=service-ricplt-a1mediator-rmr.ricplt:4562 open=0 succ=0 fail=0 (hard=0 soft=0)
1716388788 44/RMR [INFO] sends: ts=1716388788 src=e388fb7afafc:4560 target=10.0.2.10:38000 open=1 succ=5 fail=0 (hard=0 soft=0)
1716389089 44/RMR [INFO] sends: ts=1716389089 src=e388fb7afafc:4560 target=service-ricplt-a1mediator-rmr.ricplt:4562 open=0 succ=0 fail=0 (hard=0 soft=0)
1716389089 44/RMR [INFO] sends: ts=1716389089 src=e388fb7afafc:4560 target=10.0.2.10:38000 open=1 succ=5 fail=0 (hard=0 soft=0)

**ns-o-ran:**

Waf: Entering directory `/workspace/ns3-mmwave-oran/build'
Waf: Leaving directory `/workspace/ns3-mmwave-oran/build'
Build commands will be stored in build/compile_commands.json
'build' finished successfully (0.895s)
bufferSize 10 OutageThreshold -5 HandoverMode DynamicTtt e2TermIp 10.0.2.10 enableE2FileLogging 0
e2lteEnabled 1 e2nrEnabled 1 e2du 1 e2cuCp 1 e2cuUp 1 controlFilename  indicationPeriodicity 0.1
[INFO ] %%about to register e2sm func desc for 200

[INFO ] %%about to register callback for subscription for func_id 200
[INFO ] %%about to register e2sm func desc for 300

[INFO ] %%about to register callback for e2sm for func_id 300
+0.000000000s -1 MmWaveEnbNetDevice:SetE2Termination(): [DEBUG] Register E2SM
[INFO ] %%about to register e2sm func desc for 200

[INFO ] %%about to register callback for subscription for func_id 200
+0.000000000s -1 MmWaveEnbNetDevice:UpdateConfig(): [DEBUG] E2sim start in cell 2 force CSV logging 0
+0.000000000s -1 MmWaveEnbNetDevice:SetE2Termination(): [DEBUG] Register E2SM
[INFO ] %%about to register e2sm func desc for 200

[INFO ] %%about to register callback for subscription for func_id 200
+0.000000000s -1 MmWaveEnbNetDevice:UpdateConfig(): [DEBUG] E2sim start in cell 3 force CSV logging 0
+0.000000000s -1 MmWaveEnbNetDevice:SetE2Termination(): [DEBUG] Register E2SM
[INFO ] %%about to register e2sm func desc for 200

[INFO ] %%about to register callback for subscription for func_id 200
+0.000000000s -1 MmWaveEnbNetDevice:UpdateConfig(): [DEBUG] E2sim start in cell 4 force CSV logging 0
+0.000000000s -1 MmWaveEnbNetDevice:SetE2Termination(): [DEBUG] Register E2SM
[INFO ] %%about to register e2sm func desc for 200

[INFO ] %%about to register callback for subscription for func_id 200
+0.000000000s -1 MmWaveEnbNetDevice:UpdateConfig(): [DEBUG] E2sim start in cell 5 force CSV logging 0
Simulation time is 2 seconds 
[UNCON] Start E2 Agent (E2 Simulator)
[UNCON] Current Log level is 2
[INFO ] [SCTP] Binding client socket with source port 38471
[INFO ] [SCTP] Connecting to server at 10.0.2.10:36422 ...
[UNCON] Start E2 Agent (E2 Simulator)
[UNCON] Current Log level is 2
[INFO ] [SCTP] Binding client socket with source port 38472
[INFO ] [SCTP] Connecting to server at 10.0.2.10:36422 ...
[UNCON] Start E2 Agent (E2 Simulator)
[UNCON] Current Log level is 2
[INFO ] [SCTP] Binding client socket with source port 38473
[INFO ] [SCTP] Connecting to server at 10.0.2.10:36422 ...
[UNCON] Start E2 Agent (E2 Simulator)
[UNCON] Current Log level is 2
[INFO ] [SCTP] Binding client socket with source port 38474
[INFO ] [SCTP] Connecting to server at 10.0.2.10:36422 ...
[UNCON] Start E2 Agent (E2 Simulator)
[UNCON] Current Log level is 2
[INFO ] [SCTP] Binding client socket with source port 38475
[INFO ] [SCTP] Connecting to server at 10.0.2.10:36422 ...
[ERROR] [ERROR] [ERROR] [SCTP] Connection error: Connection timed out[SCTP] Connection error: Connection timed out
[SCTP] Connection error: Connection timed out

assert failed. cond="m_ptr", msg="Attempted to dereference zero pointer", +1.513982141s -1 file=./ns3/ptr.h, line=638
terminate called without an active exception
Command ['/workspace/ns3-mmwave-oran/build/scratch/scenario-zero'] terminated with signal SIGSEGV. Run it under a debugger to get more information (./waf --run <program> --gdb").

**Comment by sonalichaudhari37** [comment]
At another attempt, I got following error at ns-o-ran terminal:

Simulation time is 2 seconds 
[UNCON] Start E2 Agent (E2 Simulator)
[UNCON] Current Log level is 2
[INFO ] [SCTP] Binding client socket with source port 38471
[INFO ] [SCTP] Connecting to server at 10.0.2.10:36422 ...
[ERROR] [SCTP] Connection error: Cannot assign requested address
[UNCON] Start E2 Agent (E2 Simulator)
[UNCON] Current Log level is 2
[INFO ] [SCTP] Binding client socket with source port 38472
[INFO ] [SCTP] Connecting to server at 10.0.2.10:36422 ...
[ERROR] [SCTP] Connection error: Cannot assign requested address
assert failed. cond="m_ptr", msg="Attempted to dereference zero pointer", +0.000000000s -1 file=./ns3/ptr.h, line=630
terminate called without an active exception
Command ['/workspace/ns3-mmwave-oran/build/scratch/scenario-zero'] terminated with signal SIGIOT. Run it under a debugger to get more information (./waf --run <program> --gdb").

**Comment by Thecave3** [comment]
Hi, it looks to me that you have a connectivity issue between ns-O-RAN and the RIC, this is probably due to a misconfiguration on your end. 
Did you set the correct address of the E2 Interface?

**Comment by sonalichaudhari37** [comment]
Where can I check the IP address of the E2 interface?

**Comment by Thecave3** [comment]
> Where can I check the IP address of the E2 interface?

https://stackoverflow.com/a/46310428/4575505

> Later, I changed the IP address from 10.0.2.10 to 10.0.2.1 in sceanario-zero.cc as e2term is bound to 10.0.2.1:36422. But the error still persist. 

The IP address can be set when you launch the scenario-one including the flag `--e2TermIp=<IP_E2_TERM>`.

ns-O-RAN is using e2sim under the hood, i.e., the E2 IP that you are including is sent to the e2sim library to setup the SCTP connection. You need to include the IP of the RIC E2 termination.

**Comment by sonalichaudhari37** [comment]
Hi,
Thank you for your prompt response!
I checked the IP address of e2term and its correct (same as default 10.0.2.10).  

To understand why the connection is not established, I checked logs using tcpdump at e2term and ns-o-ran containers and concluded that both are communicating at IP Layer and hence connection is not an issue. I observed that ns-o-ran is sending "INIT" and e2term is sending "INIT ACK". But I didn't observe any related message on xApp container.

After multiple exchanges of INIT and INIT ACK, ns-o-ran script terminates saying connection time out.

Please find the logs I'm attaching to this comment. I couldn't upload full log files. So I'm adding part of relevant captured messages.
![errorAtns-o-ran](https://github.com/wineslab/ns-o-ran-ns3-mmwave/assets/28389990/ddcd5136-8945-4d6a-b727-4b1f76d5276b)

At e2term:

21:28:02.856909 IP e2mgr.ric.3801 > 7875921b326f.56808: Flags [.], ack 297882, win 501, options [nop,nop,TS val 3960301078 ecr 1952405321], length 0
21:28:03.249126 IP ns-o-ran.ric.38471 > 7875921b326f.36422: sctp (1) [INIT] [init tag: 2635993518] [rwnd: 106496] [OS: 10] [MIS: 65535] [init TSN: 2753246987] 
21:28:03.249195 IP 7875921b326f.36422 > ns-o-ran.ric.38471: sctp (1) [INIT ACK] [init tag: 2909483756] [rwnd: 106496] [OS: 10] [MIS: 10] [init TSN: 2213317907] 
21:28:03.257248 IP ns-o-ran.ric.38472 > 7875921b326f.36422: sctp (1) [INIT] [init tag: 1596052021] [rwnd: 106496] [OS: 10] [MIS: 65535] [init TSN: 289192650] 
21:28:03.257340 IP 7875921b326f.36422 > ns-o-ran.ric.38472: sctp (1) [INIT ACK] [init tag: 250228783] [rwnd: 106496] [OS: 10] [MIS: 10] [init TSN: 1136669377] 
21:28:03.283142 IP ns-o-ran.ric.38473 > 7875921b326f.36422: sctp (1) [INIT] [init tag: 3559707387] [rwnd: 106496] [OS: 10] [MIS: 65535] [init TSN: 2793987762] 
21:28:03.283178 IP 7875921b326f.36422 > ns-o-ran.ric.38473: sctp (1) [INIT ACK] [init tag: 4113467352] [rwnd: 106496] [OS: 10] [MIS: 10] [init TSN: 1753340841] 
21:28:03.305181 IP ns-o-ran.ric.38474 > 7875921b326f.36422: sctp (1) [INIT] [init tag: 2754052063] [rwnd: 106496] [OS: 10] [MIS: 65535] [init TSN: 1556188884] 
21:28:03.305254 IP 7875921b326f.36422 > ns-o-ran.ric.38474: sctp (1) [INIT ACK] [init tag: 236388191] [rwnd: 106496] [OS: 10] [MIS: 10] [init TSN: 3920898573] 
21:28:03.325601 IP ns-o-ran.ric.38475 > 7875921b326f.36422: sctp (1) [INIT] [init tag: 46633255] [rwnd: 106496] [OS: 10] [MIS: 65535] [init TSN: 3425921333] 
21:28:03.325672 IP 7875921b326f.36422 > ns-o-ran.ric.38475: sctp (1) [INIT ACK] [init tag: 3867260372] [rwnd: 106496] [OS: 10] [MIS: 10] [init TSN: 941483194] 
21:28:04.356677 IP e2mgr.ric.35284 > 7875921b326f.38000: Flags [P.], seq 164996:165330, ack 1, win 502, options [nop,nop,TS val 3960302578 ecr 1952405321], length 334
21:28:04.356711 IP 7875921b326f.38000 > e2mgr.ric.35284: Flags [.], ack 165330, win 6146, options [nop,nop,TS val 1952406821 ecr 3960302578], length 0
21:28:04.356946 IP 7875921b326f.56808 > e2mgr.ric.3801: Flags [P.], seq 297882:298485, ack 1, win 502, options [nop,nop,TS val 1952406821 ecr 3960301078], length 603
21:28:04.356994 IP e2mgr.ric.3801 > 7875921b326f.56808: Flags [.], ack 298485, win 501, options [nop,nop,TS val 3960302578 ecr 1952406821], length 0
21:28:05.856657 IP e2mgr.ric.35284 > 7875921b326f.38000: Flags [P.], seq 165330:165664, ack 1, win 502, options [nop,nop,TS val 3960304078 ecr 1952406821], length 334
21:28:05.856713 IP 7875921b326f.38000 > e2mgr.ric.35284: Flags [.], ack 165664, win 6146, options [nop,nop,TS val 1952408321 ecr 3960304078], length 0
21:28:05.856835 IP 7875921b326f.56808 > e2mgr.ric.3801: Flags [P.], seq 298485:299088, ack 1, win 502, options [nop,nop,TS val 1952408321 ecr 3960302578], length 603
21:28:05.856850 IP e2mgr.ric.3801 > 7875921b326f.56808: Flags [.], ack 299088, win 501, options [nop,nop,TS val 3960304078 ecr 1952408321], length 0
21:28:06.463644 IP ns-o-ran.ric.38473 > 7875921b326f.36422: sctp (1) [INIT] [init tag: 3559707387] [rwnd: 106496] [OS: 10] [MIS: 65535] [init TSN: 2793987762] 
21:28:06.463644 IP ns-o-ran.ric.38472 > 7875921b326f.36422: sctp (1) [INIT] [init tag: 1596052021] [rwnd: 106496] [OS: 10] [MIS: 65535] [init TSN: 289192650] 
21:28:06.463669 IP ns-o-ran.ric.38471 > 7875921b326f.36422: sctp (1) [INIT] [init tag: 2635993518] [rwnd: 106496] [OS: 10] [MIS: 65535] [init TSN: 2753246987] 
21:28:06.463679 IP 7875921b326f.36422 > ns-o-ran.ric.38472: sctp (1) [INIT ACK] [init tag: 344985730] [rwnd: 106496] [OS: 10] [MIS: 10] [init TSN: 1009618581] 
21:28:06.463694 IP 7875921b326f.36422 > ns-o-ran.ric.38473: sctp (1) [INIT ACK] [init tag: 1110473089] [rwnd: 106496] [OS: 10] [MIS: 10] [init TSN: 3085252845] 
21:28:06.463708 IP 7875921b326f.36422 > ns-o-ran.ric.38471: sctp (1) [INIT ACK] [init tag: 2025330555] [rwnd: 106496] [OS: 10] [MIS: 10] [init TSN: 3853726046] 
21:28:06.467583 IP ns-o-ran.ric.38475 > 7875921b326f.36422: sctp (1) [INIT] [init tag: 46633255] [rwnd: 106496] [OS: 10] [MIS: 65535] [init TSN: 3425921333] 
21:28:06.467606 IP 7875921b326f.36422 > ns-o-ran.ric.38475: sctp (1) [INIT ACK] [init tag: 3716015740] [rwnd: 106496] [OS: 10] [MIS: 10] [init TSN: 2064869014] 
21:28:06.467611 IP ns-o-ran.ric.38474 > 7875921b326f.36422: sctp (1) [INIT] [init tag: 2754052063] [rwnd: 106496] [OS: 10] [MIS: 65535] [init TSN: 1556188884] 
21:28:06.467646 IP 7875921b326f.36422 > ns-o-ran.ric.38474: sctp (1) [INIT ACK] [init tag: 3882269627] [rwnd: 106496] [OS: 10] [MIS: 10] [init TSN: 1888730746] 
21:28:07.356671 IP e2mgr.ric.35284 > 7875921b326f.38000: Flags [P.], seq 165664:165998, ack 1, win 502, options [nop,nop,TS val 3960305578 ecr 1952408321], length 334
21:28:07.356688 IP 7875921b326f.38000 > e2mgr.ric.35284: Flags [.], ack 165998, win 6146, options [nop,nop,TS val 1952409821 ecr 3960305578], length 0
21:28:07.356807 IP 7875921b326f.56808 > e2mgr.ric.3801: Flags [P.], seq 299088:299691, ack 1, win 502, options [nop,nop,TS val 1952409821 ecr 3960304078], length 603
21:28:07.356874 IP e2mgr.ric.3801 > 7875921b326f.56808: Flags [.], ack 299691, win 501, options [nop,nop,TS val 3960305578 ecr 1952409821], length 0
21:28:08.255600 ARP, Request who-has ns-o-ran.ric tell 7875921b326f, length 28
21:28:08.255627 ARP, Request who-has 7875921b326f tell ns-o-ran.ric, length 28
21:28:08.255635 ARP, Reply 7875921b326f is-at 02:42:0a:00:02:0a (oui Unknown), length 28
21:28:08.255636 ARP, Reply ns-o-ran.ric is-at 02:42:0a:00:02:02 (oui Unknown), length 28

At ns-o-ran:
21:29:39.135605 IP d3c55108d56d.38471 > e2term.ric.36422: sctp (1) [INIT] [init tag: 2635993518] [rwnd: 106496] [OS: 10] [MIS: 65535] [init TSN: 2753246987] 
21:29:39.135606 IP d3c55108d56d.38472 > e2term.ric.36422: sctp (1) [INIT] [init tag: 1596052021] [rwnd: 106496] [OS: 10] [MIS: 65535] [init TSN: 289192650] 
21:29:39.135605 IP d3c55108d56d.38473 > e2term.ric.36422: sctp (1) [INIT] [init tag: 3559707387] [rwnd: 106496] [OS: 10] [MIS: 65535] [init TSN: 2793987762] 
21:29:39.135606 IP d3c55108d56d.38475 > e2term.ric.36422: sctp (1) [INIT] [init tag: 46633255] [rwnd: 106496] [OS: 10] [MIS: 65535] [init TSN: 3425921333] 
21:29:39.135606 IP d3c55108d56d.38474 > e2term.ric.36422: sctp (1) [INIT] [init tag: 2754052063] [rwnd: 106496] [OS: 10] [MIS: 65535] [init TSN: 1556188884] 
21:29:39.135677 IP e2term.ric.36422 > d3c55108d56d.38474: sctp (1) [INIT ACK] [init tag: 2946905556] [rwnd: 106496] [OS: 10] [MIS: 10] [init TSN: 3941866512] 
21:29:39.135718 IP e2term.ric.36422 > d3c55108d56d.38475: sctp (1) [INIT ACK] [init tag: 749831823] [rwnd: 106496] [OS: 10] [MIS: 10] [init TSN: 648972590] 
21:29:44.255537 ARP, Request who-has e2term.ric tell d3c55108d56d, length 28
21:29:44.255610 ARP, Reply e2term.ric is-at 02:42:0a:00:02:0a (oui Unknown), length 28
21:29:44.255648 ARP, Request who-has d3c55108d56d tell e2term.ric, length 28
21:29:44.255675 ARP, Reply d3c55108d56d is-at 02:42:0a:00:02:02 (oui Unknown), length 28
21:30:01.663809 IP6 eb3-2402-std01.csc.ncsu.edu.mdns > ff02::fb.mdns: 0 [9q] PTR (QM)? _ipps._tcp.local. PTR (QM)? _ftp._tcp.local. PTR (QM)? _webdav._tcp.local. PTR (QM)? _webdavs._tcp.local. PTR (QM)? _sftp-ssh._tcp.local. PTR (QM)? _smb._tcp.local. PTR (QM)? _afpovertcp._tcp.local. PTR (QM)? _nfs._tcp.local. PTR (QM)? _ipp._tcp.local. (141)
21:30:40.575594 IP d3c55108d56d.38471 > e2term.ric.36422: sctp (1) [INIT] [init tag: 2635993518] [rwnd: 106496] [OS: 10] [MIS: 65535] [init TSN: 2753246987] 
21:30:40.575594 IP d3c55108d56d.38473 > e2term.ric.36422: sctp (1) [INIT] [init tag: 3559707387] [rwnd: 106496] [OS: 10] [MIS: 65535] [init TSN: 2793987762] 
21:30:40.575594 IP d3c55108d56d.38472 > e2term.ric.36422: sctp (1) [INIT] [init tag: 1596052021] [rwnd: 106496] [OS: 10] [MIS: 65535] [init TSN: 289192650] 
21:30:40.575594 IP d3c55108d56d.38475 > e2term.ric.36422: sctp (1) [INIT] [init tag: 46633255] [rwnd: 106496] [OS: 10] [MIS: 65535] [init TSN: 3425921333] 
21:30:40.575702 IP e2term.ric.36422 > d3c55108d56d.38471: sctp (1) [INIT ACK] [init tag: 3259279764] [rwnd: 106496] [OS: 10] [MIS: 10] [init TSN: 535700510] 
21:30:40.575718 IP e2term.ric.36422 > d3c55108d56d.38473: sctp (1) [INIT ACK] [init tag: 2223754836] [rwnd: 106496] [OS: 10] [MIS: 10] [init TSN: 277727890] 
21:30:40.575733 IP e2term.ric.36422 > d3c55108d56d.38475: sctp (1) [INIT ACK] [init tag: 2137575437] [rwnd: 106496] [OS: 10] [MIS: 10] [init TSN: 2950523613] 
21:30:40.575749 IP e2term.ric.36422 > d3c55108d56d.38472: sctp (1) [INIT ACK] [init tag: 990510158] [rwnd: 106496] [OS: 10] [MIS: 10] [init TSN: 4158583077] 
21:30:40.579542 IP d3c55108d56d.38474 > e2term.ric.36422: sctp (1) [INIT] [init tag: 2754052063] [rwnd: 106496] [OS: 10] [MIS: 65535] [init TSN: 1556188884] 
21:30:40.579654 IP e2term.ric.36422 > d3c55108d56d.38474: sctp (1) [INIT ACK] [init tag: 4045059611] [rwnd: 106496] [OS: 10] [MIS: 10] [init TSN: 4037916106] 
21:30:45.695613 ARP, Request who-has d3c55108d56d tell e2term.ric, length 28
21:30:45.695622 ARP, Reply d3c55108d56d is-at 02:42:0a:00:02:02 (oui Unknown), length 28
21:30:45.699535 ARP, Request who-has e2term.ric tell d3c55108d56d, length 28
21:30:45.699595 ARP, Reply e2term.ric is-at 02:42:0a:00:02:0a (oui Unknown), length 28

At sample-xapp-24
21:21:08.180082 IP6 eb3-2402-std01.csc.ncsu.edu.mdns > ff02::fb.mdns: 0 [9q] PTR (QM)? _ipps._tcp.local. PTR (QM)? _ftp._tcp.local. PTR (QM)? _webdav._tcp.local. PTR (QM)? _webdavs._tcp.local. PTR (QM)? _sftp-ssh._tcp.local. PTR (QM)? _smb._tcp.local. PTR (QM)? _afpovertcp._tcp.local. PTR (QM)? _nfs._tcp.local. PTR (QM)? _ipp._tcp.local. (141)
21:21:09.183634 IP6 eb3-2402-std01.csc.ncsu.edu > ip6-allrouters: ICMP6, router solicitation, length 16
21:23:01.768508 IP6 eb3-2402-std01.csc.ncsu.edu.mdns > ff02::fb.mdns: 0 [7q] PTR (QM)? _ftp._tcp.local. PTR (QM)? _nfs._tcp.local. PTR (QM)? _afpovertcp._tcp.local. PTR (QM)? _smb._tcp.local. PTR (QM)? _sftp-ssh._tcp.local. PTR (QM)? _webdavs._tcp.local. PTR (QM)? _webdav._tcp.local. (118)
21:23:01.768696 IP eb3-2402-std01.csc.ncsu.edu.mdns > mdns.mcast.net.mdns: 0 [7q] PTR (QM)? _ftp._tcp.local. PTR (QM)? _nfs._tcp.local. PTR (QM)? _afpovertcp._tcp.local. PTR (QM)? _smb._tcp.local. PTR (QM)? _sftp-ssh._tcp.local. PTR (QM)? _webdavs._tcp.local. PTR (QM)? _webdav._tcp.local. (118)
21:25:24.232156 IP6 eb3-2402-std01.csc.ncsu.edu.mdns > ff02::fb.mdns: 0 [9q] PTR (QM)? _ipps._tcp.local. PTR (QM)? _ftp._tcp.local. PTR (QM)? _webdav._tcp.local. PTR (QM)? _webdavs._tcp.local. PTR (QM)? _sftp-ssh._tcp.local. PTR (QM)? _smb._tcp.local. PTR (QM)? _afpovertcp._tcp.local. PTR (QM)? _nfs._tcp.local. PTR (QM)? _ipp._tcp.local. (141)
21:25:47.711638 IP6 eb3-2402-std01.csc.ncsu.edu > ip6-allrouters: ICMP6, router solicitation, length 16
21:33:56.332073 IP6 eb3-2402-std01.csc.ncsu.edu.mdns > ff02::fb.mdns: 0 [9q] PTR (QM)? _ipps._tcp.local. PTR (QM)? _ftp._tcp.local. PTR (QM)? _webdav._tcp.local. PTR (QM)? _webdavs._tcp.local. PTR (QM)? _sftp-ssh._tcp.local. PTR (QM)? _smb._tcp.local. PTR (QM)? _afpovertcp._tcp.local. PTR (QM)? _nfs._tcp.local. PTR (QM)? _ipp._tcp.local. (141)
21:34:48.387573 IP6 eb3-2402-std01.csc.ncsu.edu > ip6-allrouters: ICMP6, router solicitation, length 16

**Comment by Thecave3** [comment]
I don't think this wall text is relevant. 
The issue lies in the connectivity between your docker containers.
Please check your network settings.
